{"schema_version":"lab-work-order-v1","contract_version":"1.0.0","verification_status":"draft-validated","open_issues":[],"work_order":{"id":"WO-ROBOT-DT","scenario_id":"SCN-ROBOT-DT","module_id":"MOD-ROBOT-DT","title":"数字孪生工业机器人工作站调试与恢复","objective":"在隔离仿真中完成机器人轨迹、PLC I/O和异常恢复验证","competency_ids":["COMP-ROBOT-SAFETY","COMP-ROBOT-TEACH","COMP-ROBOT-DT"],"duration_minutes":120,"prerequisites":["完成安全培训与点检","教师确认仿真环境为离线隔离模式"],"resources":[{"name":"机器人数字孪生工作站","quantity":1,"unit":"套","version":"DT-1.0"},{"name":"PLC仿真器","quantity":1,"unit":"套","version":"PLC-SIM-1.0"},{"name":"安全检查表","quantity":1,"unit":"份"}],"steps":[{"sequence":1,"instruction":"确认急停、联锁和安全默认态，加载场景","expected_output":"安全状态为可运行且无报警","checkpoint":"CP-01","risk_control":"未通过则停止，不接入真实执行器"},{"sequence":2,"instruction":"导入TCP/Wobj坐标并回放低速轨迹","expected_output":"轨迹无碰撞且误差在±1 mm","checkpoint":"CP-02","risk_control":"离线、限速、教师放行"},{"sequence":3,"instruction":"触发I/O、断链和碰撞异常并执行恢复","expected_output":"报警可见，恢复至最近安全点","checkpoint":"CP-03","risk_control":"不得绕过急停/联锁"}],"acceptance_criteria":[{"criterion":"轨迹安全","threshold":"0次碰撞，位置误差≤1 mm","measurement":"仿真碰撞日志与坐标偏差","evidence":"trajectory.log"},{"criterion":"恢复行为","threshold":"100%异常回到安全checkpoint","measurement":"故障注入测试","evidence":"recovery.log"}],"safety_controls":[{"hazard":"机器人意外运动","control":"离线隔离、虚拟I/O、低速模式","stop_condition":"碰撞、联锁或急停信号异常","emergency_action":"停止仿真并通知教师"},{"hazard":"电气/PLC误接入","control":"断开真实PLC与执行器，使用仿真地址","stop_condition":"发现非仿真地址","emergency_action":"断电隔离并封存配置"}],"deliverables":["程序文件","I/O映射表","仿真日志","故障报告"],"rubric":[{"criterion":"安全控制","weight":30,"anchors":["未执行安全检查","完整执行并留证"]},{"criterion":"轨迹与坐标","weight":30,"anchors":["碰撞或超差","无碰撞且达标"]},{"criterion":"I/O与恢复","weight":30,"anchors":["无法恢复","全部异常可恢复"]},{"criterion":"证据完整性","weight":10,"anchors":["缺失日志","提交完整可审计包"]}]},"tracking_chain":["JOB-ROBOT-001 -> COMP-ROBOT-DT -> MOD-ROBOT-DT -> SCN-ROBOT-DT -> WO-ROBOT-DT"]}